title,link,link_type,published,summary
Is An Election Vibe Shift Underway?,https://www.podtrac.com/pts/redirect.mp3/pscrb.fm/rss/p/traffic.megaphone.fm/ESP8053095433.mp3?updated=1711402661,audio/mpeg,"Mon, 25 Mar 2024 21:37:52 -0000","Is the presidential election undergoing a vibe shift? At the beginning of the month, former President Donald Trump was performing 10 percentage points better than President Joe Biden in net approval rating. Today that’s fallen to a 4-point advantage. In this installment of the 538 Politics podcast, the crew assesses what's changed. They also ask why so many representatives in the House are resigning earlier on in their careers and they take a look at a new poll showing Republican Larry Hogan leading in the Maryland Senate race by double digits.
Learn more about your ad choices. Visit megaphone.fm/adchoices"
538 Debate Club: Should TikTok Be Banned?,https://www.podtrac.com/pts/redirect.mp3/pscrb.fm/rss/p/traffic.megaphone.fm/ESP7780379791.mp3?updated=1711055165,audio/mpeg,"Thu, 21 Mar 2024 21:07:44 -0000","Last week, the House of Representatives passed a bipartisan bill that would ban TikTok unless its owner, the Chinese company ByteDance, sells its stake in the app. This decision has ignited a national debate about TikTok and the effects of social media. So, in true 538 fashion, we’re reintroducing a segment we like to call ‘Debate Club’ to discuss the issue. In this installment of the 538 Politics podcast, Senior Elections Analyst Geoffrey Skelley, Podcast Intern Jala Everett, and Senior Editor and Senior Elections Analyst Nathaniel Rakich engage in a spirited debate. They'll defend their arguments on whether to ban TikTok, maintain the status quo or even consider banning social media altogether.
Learn more about your ad choices. Visit megaphone.fm/adchoices"
How Worried Should Democrats Be About The Polls?,https://www.podtrac.com/pts/redirect.mp3/pscrb.fm/rss/p/traffic.megaphone.fm/ESP1433401020.mp3?updated=1710799014,audio/mpeg,"Mon, 18 Mar 2024 21:55:13 -0000","The presidential candidates are trying to crowd us out of the polling analysis business with their own takes on the polls! In this installment of the 538 Politics podcast, the crew assesses whether President Joe Biden's dismissal of polls because of declining response rates is fair.
They also reexamine a viral poll from late last year that suggested 20 percent of young Americans think the Holocaust is a myth. It turned out to likely be bogus. And they preview Tuesday's primary in Ohio that will determine which Republican runs against Democratic Sen. Sherrod Brown.
Learn more about your ad choices. Visit megaphone.fm/adchoices"
Do Campaign Stops Actually Matter?,https://www.podtrac.com/pts/redirect.mp3/pscrb.fm/rss/p/traffic.megaphone.fm/ESP5194267741.mp3?updated=1710451702,audio/mpeg,"Thu, 14 Mar 2024 21:22:51 -0000","After Tuesday’s primaries, President Joe Biden and former President Donald Trump have mathematically clinched their parties’ nominations. And now, it’s off to the races. Over the past week, Biden has made campaign stops in Pennsylvania, Georgia, New Hampshire, Michigan and Wisconsin. Trump was also in Georgia last weekend and he’ll be in Ohio on Saturday.
These kinds of campaign stops are a cornerstone of presidential campaigns and we can expect a lot more of them between now and November. There’s only one problem: According to political scientist Chris Devine, they don’t actually work. At least, not all that well and not in the ways you’d expect. In this installment of the 538 Politics podcast, Devine talks about his recently published book called, “I’m Here to Ask for Your Vote: How Presidential Campaign Visits Influence Voters.""
Learn more about your ad choices. Visit megaphone.fm/adchoices"
Does Gen Z Really Care More About That Viral TikTok Than Politics?,https://www.podtrac.com/pts/redirect.mp3/pscrb.fm/rss/p/traffic.megaphone.fm/ESP4381014855.mp3?updated=1710259107,audio/mpeg,"Mon, 11 Mar 2024 23:24:00 -0000","The general election has begun in earnest and in this installment of the 538 Politics podcast, the crew assesses how the country is feeling about it with a game of “Guess What Americans Think.” What percentage of Americans think the country is on the right track? Or that their preferred candidate will win?
They also ask whether a poll suggesting that Gen Z voters are paying more attention to viral TikToks than the Alabama Supreme Court ruling on in vitro fertilization is a “good or bad use of polling.”
--
Sponsor Message: Secure your privacy with Surfshark! Enter coupon code FIVE38 for an extra 3 months free at https://surfshark.deals/FIVE38
Learn more about your ad choices. Visit megaphone.fm/adchoices"
A Very Political State Of The Union,https://www.podtrac.com/pts/redirect.mp3/pscrb.fm/rss/p/traffic.megaphone.fm/ESP5514949025.mp3?updated=1709889230,audio/mpeg,"Fri, 08 Mar 2024 09:09:15 -0000","In this late night installment of the 538 Politics podcast, the crew reacts to President Biden's State of the Union speech and Alabama Sen. Katie Britt's rebuttal. Both put top 2024 campaign issue front and center.
Learn more about your ad choices. Visit megaphone.fm/adchoices"
Super Tuesday Brings A Couple Surprises,https://www.podtrac.com/pts/redirect.mp3/pscrb.fm/rss/p/traffic.megaphone.fm/ESP5676937877.mp3?updated=1709718555,audio/mpeg,"Wed, 06 Mar 2024 09:46:14 -0000","In a late-night podcast, the crew reacts to the Super Tuesday results, including a win by former U.N. Ambassador Nikki Haley in Vermont and a win by entrepreneur Jason Palmer in American Samoa.
Learn more about your ad choices. Visit megaphone.fm/adchoices"
What To Watch For On Super Tuesday,https://www.podtrac.com/pts/redirect.mp3/pscrb.fm/rss/p/traffic.megaphone.fm/ESP8191713600.mp3?updated=1709599227,audio/mpeg,"Tue, 05 Mar 2024 00:37:47 -0000","Super Tuesday is upon us. In this installment of the 538 Politics podcast, the crew previews what we can expect and debates whether any of it really matters. Later in the show, Atlanta Journal-Constitution Washington Correspondent Tia Mitchell joins and they turn their focus to Washington, D.C., to discuss Senate Minority Leader Mitch McConnell’s announcement that he will soon step down as head of the Senate Republican Conference and how Congress is responding to the recent ruling by the Alabama Supreme Court regarding in vitro fertilization.
Learn more about your ad choices. Visit megaphone.fm/adchoices"
What To Make Of The Protest Votes In Michigan,https://www.podtrac.com/pts/redirect.mp3/pscrb.fm/rss/p/traffic.megaphone.fm/ESP8389596321.mp3?updated=1709159138,audio/mpeg,"Wed, 28 Feb 2024 22:23:24 -0000","The Michigan primary resulted in easy victories for both former president Donald Trump and President Joe Biden, but it also laid bare some discontent in both parties. In this installment of the 538 Politics podcast, Galen speaks with Bridge Michigan politics reporter Jonathan Oosting, POLITICO senior Washington correspondent and co-author of Playbook Rachael Bade, and 538 director of data analytics G. Elliott Morris about Trump's and Biden's vulnerabilities within their own parties. Later in the show the crew turns its focus to Washington to discuss the looming partial government shutdown and how immigration is continuing to grow as a key issue for voters. They also question whether a recent poll using pictures of Robert F. Kennedy Jr. is a ""good or bad use of polling?”
Learn more about your ad choices. Visit megaphone.fm/adchoices"
"After South Carolina Loss, What Is Nikki Haley's Plan?",https://www.podtrac.com/pts/redirect.mp3/pscrb.fm/rss/p/traffic.megaphone.fm/ESP5795671080.mp3?updated=1708886776,audio/mpeg,"Sun, 25 Feb 2024 18:42:32 -0000","In a late-night edition of the 538 Politics podcast, the crew reacts to former President Donald Trump's win in South Carolina and asks what former U.N. Ambassador Nikki Haley's plan is going forward.
Learn more about your ad choices. Visit megaphone.fm/adchoices"
Foreign Policy Has Become A Family Feud,https://www.podtrac.com/pts/redirect.mp3/pscrb.fm/rss/p/traffic.megaphone.fm/ESP4577646027.mp3?updated=1708643788,audio/mpeg,"Thu, 22 Feb 2024 23:13:40 -0000","Both Democrats and Republicans are facing intraparty conflict over foreign policy, Democrats over the war in Gaza and Republicans over the war in Ukraine. Could these conflicts help determine who wins the presidency in November?
On this episode of the 538 Politics podcast, the crew invites Dina Smeltz, senior fellow on public opinion and foreign policy at The Chicago Council on Global Affairs, to break down how the conflicts in Gaza and Ukraine have divided the parties. They also preview the upcoming South Carolina primary race, and ask whether a recent poll of political scientists intending to create a ranking of American presidents was a good or bad use of polling.
Learn more about your ad choices. Visit megaphone.fm/adchoices"
What Comes Next In Trump's Trials,https://www.podtrac.com/pts/redirect.mp3/pscrb.fm/rss/p/traffic.megaphone.fm/ESP2983129654.mp3?updated=1708132926,audio/mpeg,"Mon, 19 Feb 2024 14:00:00 -0000","This Presidents Day installment of the 538 Politics podcast grapples with a central question in the 2024 election: What are the legal limits of presidential behavior?
Former President Donald Trump is facing 91 criminal charges across four different cases as he campaigns for the White House. Law professor Jessica Roth joins Galen to discuss some of the recent developments in each of the cases and what to expect next.
Last week, the judge in the New York hush money case ruled that the trial will begin March 25, meaning it’s now expected to be the first of Trump's cases to be tried. Also, Fulton County DA Fani Willis testified in a hearing to dismiss her from the Georgia election case; the defendants are pushing to have her disqualified on the basis of an alleged conflict of interest.
Learn more about your ad choices. Visit megaphone.fm/adchoices"
Democrats Notch A Win In The Battle For The Suburbs,https://www.podtrac.com/pts/redirect.mp3/pscrb.fm/rss/p/traffic.megaphone.fm/ESP1247582436.mp3?updated=1707904768,audio/mpeg,"Wed, 14 Feb 2024 09:56:12 -0000","In this late-night installment of the 538 Politics podcast, the crew breaks down the results of the special election in New York's 3rd Congressional District. Democrat Tom Suozzi beat Republican Mazi Pilip in a race to replace former Rep. George Santos.
Learn more about your ad choices. Visit megaphone.fm/adchoices"
The Political Conversation About Biden's Age,https://www.podtrac.com/pts/redirect.mp3/pscrb.fm/rss/p/traffic.megaphone.fm/ESP4512847899.mp3?updated=1707784394,audio/mpeg,"Tue, 13 Feb 2024 00:03:00 -0000","Voters in New York's 3rd Congressional District are heading to the polls on Tuesday to choose a replacement for former Rep. George Santos. In this installment of the 538 Politics podcast, the crew discusses the dynamics at play in the most high profile special election this year. They also look at Americans' perceptions of President Joe Biden's age, after a special counsel report described him as a “well-meaning, elderly man with a poor memory,” and they talk about what comes next in the politics of border security.
Learn more about your ad choices. Visit megaphone.fm/adchoices"
The Data Points That Will Explain The 2024 Election,https://www.podtrac.com/pts/redirect.mp3/pscrb.fm/rss/p/traffic.megaphone.fm/ESP3987431649.mp3?updated=1707428231,audio/mpeg,"Thu, 08 Feb 2024 21:33:32 -0000","What is the most valuable data point to watch heading into the 2024 presidential election? This week on the 538 Politics podcast, we interviewed more than a dozen experts — pollsters, political scientists, data journalists — and asked them this one question. Their combined answers paint a picture of which variables will most influence the election this November. Galen and his guests cover voters' shifting perceptions of the two candidates, issues and key demographics that could make or break them, and the importance of ""double haters,"" voters who have negative opinions of both President Joe Biden and former President Donald Trump. 
Learn more about your ad choices. Visit megaphone.fm/adchoices"
The Tortured Pundits Department,https://www.podtrac.com/pts/redirect.mp3/pscrb.fm/rss/p/traffic.megaphone.fm/ESP8739966917.mp3?updated=1707176654,audio/mpeg,"Mon, 05 Feb 2024 23:39:32 -0000","How much influence does Taylor Swift actually have? Would her endorsement in a presidential election move voters? Has her presence at NFL games already created new fans among young women? Some have used polling to suggest it has, so in this installment of the 538 Politics podcast, we ask ""good or bad use of polling?""
The crew also looks at some of the minor primary contests between now and the South Carolina Republican presidential primary and spotlights the biggest takeaways from last quarter's campaign fundraising numbers.
Learn more about your ad choices. Visit megaphone.fm/adchoices"
How Americans Feel About The Economy,https://www.podtrac.com/pts/redirect.mp3/pscrb.fm/rss/p/traffic.megaphone.fm/ESP3098218440.mp3?updated=1706819047,audio/mpeg,"Thu, 01 Feb 2024 20:19:24 -0000","The conventional wisdom is that the economy and a president’s fate are closely tied. For much of Joe Biden’s presidency, part of the story has been that despite a strong labor market and economic growth, views of the economy and Biden’s handling of it have been abysmal.
A lot of that likely had to do with inflation, rising interest rates and a declining stock market. Trends that, as of right now, have abated and even reversed. So what’s happened over the past three years and where are we headed? And what does all of that mean for November 2024?
In this installment of the 538 Politics podcast, Galen speaks with Joanne Hsu, who directs the University of Michigan consumer sentiment survey, and Neale Mahoney, economics professor at Stanford University.
Learn more about your ad choices. Visit megaphone.fm/adchoices"
Will Politics Or Policy Win Out At The Border?,https://www.podtrac.com/pts/redirect.mp3/pscrb.fm/rss/p/traffic.megaphone.fm/ESP4576410576.mp3?updated=1706578959,audio/mpeg,"Tue, 30 Jan 2024 01:38:44 -0000","In this installment of the 538 Politics podcast, the crew explores the thorny negotiations surrounding immigration and border security in Washington. Galen talks to Carlos Odio, co-founder of Equis Research; Rachael Bade, author of POLITICO Playbook; and Leah Askarinam, 538 politics reporter. Together, the crew discusses evolving public sentiment on immigration, explores proposed policy changes and guesses what Americans think about the political landscape right now. Later in the show, Galen is joined by G. Elliott Morris, 538’s director of data analytics, to uncover more about how 538's pollster ratings are determined and reveal what are the best pollsters in America.
Learn more about your ad choices. Visit megaphone.fm/adchoices"
The GOP Primary Is Basically Over,https://www.podtrac.com/pts/redirect.mp3/pscrb.fm/rss/p/traffic.megaphone.fm/ESP7098527156.mp3?updated=1706082214,audio/mpeg,"Wed, 24 Jan 2024 07:40:46 -0000","In a late-night New Hampshire primary reaction edition of the 538 Politics podcast, the crew concludes that the GOP primary is basically over, even if not literally. They dig into the results and exit poll data to describe the coalitions that backed Trump and Haley and explain why this was Haley's best shot at scoring a win.
Learn more about your ad choices. Visit megaphone.fm/adchoices"
Is New Hampshire The End Of The GOP Primary?,https://www.podtrac.com/pts/redirect.mp3/pscrb.fm/rss/p/traffic.megaphone.fm/ESP3325357061.mp3?updated=1705968424,audio/mpeg,"Tue, 23 Jan 2024 00:03:49 -0000","The Republican primary is officially a two-person race. In this installment of the 538 Politics podcast, the crew talks about Florida Gov. Ron DeSantis dropping out of the presidential race, expectations for New Hampshire and the future of the Republican primary. They also consider whether a poll asking New Hampshire residents how well they understand the 14th Amendment is a good use of polling.
Learn more about your ad choices. Visit megaphone.fm/adchoices"
The View From New Hampshire,https://www.podtrac.com/pts/redirect.mp3/pscrb.fm/rss/p/traffic.megaphone.fm/ESP4566442737.mp3?updated=1705617692,audio/mpeg,"Thu, 18 Jan 2024 22:37:53 -0000","With New Hampshire’s first-in-the-nation primary quickly approaching, the FiveThirtyEight Politics podcast heads to the Granite State. Galen speaks with Annmarie Timmins, Senior Reporter at the New Hampshire Bulletin, and Neil Levesque, Director of the New Hampshire Institute of Politics at Saint Anselm College, about the potentially competitive contest between frontrunner former President Donald Trump and former U.N. Ambassador Nikki Haley, as well as the nuances of New Hampshire’s electorate.
Learn more about your ad choices. Visit megaphone.fm/adchoices"
Trump Wins Iowa. Now What?,https://www.podtrac.com/pts/redirect.mp3/pscrb.fm/rss/p/traffic.megaphone.fm/ESP3333676750.mp3?updated=1705400096,audio/mpeg,"Tue, 16 Jan 2024 10:13:41 -0000","The crew reacts to former President Donald Trump’s decisive victory in Iowa, as well as the race for second place, in which Florida Gov. Ron DeSantis edged out former U.N. Ambassador Nikki Haley.
Learn more about your ad choices. Visit megaphone.fm/adchoices"
The Last Debate Before Iowa,https://www.podtrac.com/pts/redirect.mp3/pscrb.fm/rss/p/traffic.megaphone.fm/ESP3318472213.mp3?updated=1704973612,audio/mpeg,"Thu, 11 Jan 2024 11:43:23 -0000","With just days until the Iowa caucuses, the crew reacts to a head-to-head debate between former U.N. Ambassador Nikki Haley and Florida Gov. Ron DeSantis, as well as a town hall featuring former President Donald Trump.
Learn more about your ad choices. Visit megaphone.fm/adchoices"
No Sleep Till Iowa,https://www.podtrac.com/pts/redirect.mp3/pscrb.fm/rss/p/traffic.megaphone.fm/ESP3314344641.mp3?updated=1704752233,audio/mpeg,"Mon, 08 Jan 2024 22:17:40 -0000","The Iowa caucuses are just a week away, and in this installment, the 538 Politics podcast sets its sights on the early states. Galen speaks with celebrated Iowa pollster Ann Selzer about likely caucusgoers' views of the candidates and how things could change in the final week of the campaign. Later in the show, Galen is joined by ABC News reporters Kendall Ross in Iowa, Kelsey Walsh in New Hampshire and Gabriella Abdul-Hakim in South Carolina. They share their insights from months of talking to voters and listening to candidates as they crisscrossed their states.
Learn more about your ad choices. Visit megaphone.fm/adchoices"
Do The Betting Markets Have 2024 Right?,https://www.podtrac.com/pts/redirect.mp3/pscrb.fm/rss/p/traffic.megaphone.fm/ESP3211100666.mp3?updated=1704404370,audio/mpeg,"Thu, 04 Jan 2024 21:36:34 -0000","The 538 Politics podcast is kicking off the new year with a game of Buy, Sell, Hold. There are a lot of unknowns as we start the year: Who will win the party nominations for president? Will a third party candidate break through? What will come of former president Donald Trump’s legal liability? And ultimately, who will win the White House, the House of Representatives and Senate? There are betting markets for just about all of these unknowns, so Galen asks the crew to make an assessment of the going odds.
They also discuss potential wildcards heading into the new year: What issues might motivate voters? How will congressional dysfunction play out? How about October surprises? 
Learn more about your ad choices. Visit megaphone.fm/adchoices"
There Has To Be A Better Way To Pick Presidential Nominees… Right?,https://www.podtrac.com/pts/redirect.mp3/pscrb.fm/rss/p/traffic.megaphone.fm/ESP8544895237.mp3?updated=1703197584,audio/mpeg,"Mon, 01 Jan 2024 21:00:00 -0000","Happy holidays, listeners! As we approach the Republican Iowa caucuses, we decided to re-air our audio documentary series, ""The Primaries Project."" This series originally aired in early 2020 and investigates how our modern primary system came to be, how it has shaped our political landscape, and how it might be improved. This is episode three of three.
Learn more about your ad choices. Visit megaphone.fm/adchoices"
How The Primary System Has Shaped Our Politics,https://www.podtrac.com/pts/redirect.mp3/pscrb.fm/rss/p/traffic.megaphone.fm/ESP1933811883.mp3?updated=1703197618,audio/mpeg,"Thu, 28 Dec 2023 21:00:00 -0000","Happy holidays, listeners! As we approach the Republican Iowa caucuses, we decided to re-air our audio documentary series, ""The Primaries Project."" This series originally aired in early 2020 and investigates how our modern primary system came to be, how it has shaped our political landscape, and how it might be improved. This is episode two of three.
Learn more about your ad choices. Visit megaphone.fm/adchoices"
Our Presidential Primary System is An Accident,https://www.podtrac.com/pts/redirect.mp3/pscrb.fm/rss/p/traffic.megaphone.fm/ESP8181880046.mp3?updated=1703196710,audio/mpeg,"Mon, 25 Dec 2023 23:00:00 -0000","Happy holidays, listeners! As we approach the Republican Iowa caucuses, we decided to re-air our audio documentary series, ""The Primaries Project."" This series originally aired in early 2020 and investigates how our modern primary system came to be, how it has shaped our political landscape, and how it might be improved. This is episode one of three.
Learn more about your ad choices. Visit megaphone.fm/adchoices"
The 538 Podcast Holiday Party,https://www.podtrac.com/pts/redirect.mp3/pscrb.fm/rss/p/traffic.megaphone.fm/ESP6182875225.mp3?updated=1703195917,audio/mpeg,"Thu, 21 Dec 2023 21:01:46 -0000","In this holiday installment of the 538 Politics podcast, the crew looks back at some of the most important political events of 2023 as well as some of the weirder political stories of the year. They also debate the thorny question of which types of cookies can be considered ""Christmas cookies"" in a festive edition of ""Good or Bad Use of Polling."" To wrap it all up, they play ""Guess What Americans Think"" and guess the answers to polling questions like, ""If Santa were a registered voter, which party would he belong to?"" 
Learn more about your ad choices. Visit megaphone.fm/adchoices"
Reaction Podcast: Colorado Supreme Court Bars Trump From Ballot,https://www.podtrac.com/pts/redirect.mp3/pscrb.fm/rss/p/traffic.megaphone.fm/ESP6819531935.mp3?updated=1703104068,audio/mpeg,"Wed, 20 Dec 2023 20:26:00 -0000","On this special reaction edition of the 538 Politics podcast, Galen speaks with Kimberly Wehle, professor of law at the University of Baltimore, and Geoffrey Skelley, senior elections analyst, about the recent ruling from the Colorado Supreme Court that bars Trump from the Colorado Republican primary ballot. They discuss the legal grounding of this ruling, the political reaction and the prospect of the U.S. Supreme Court weighing in.
Learn more about your ad choices. Visit megaphone.fm/adchoices"
Trump's Primary Challengers Are Running Out of Time,https://www.podtrac.com/pts/redirect.mp3/pscrb.fm/rss/p/traffic.megaphone.fm/ESP1315815827.mp3?updated=1702945814,audio/mpeg,"Tue, 19 Dec 2023 00:26:11 -0000","The U.S. House adjourned for the holidays last week after voting along party lines to authorize an impeachment inquiry into President Biden. The Senate is delaying its holiday recess as negotiators try to hash out a deal that would include aid to Ukraine and Israel as well as funding for border security and possible changes to asylum law.
In this installment of the 538 Politics podcast, the crew heads to Washington to discuss how Congress is closing out the year and what Americans think about it. They also mark just four weeks until the Iowa caucuses and look at what the data says about how much the polls have historically moved during the final stretch before caucus day.
And they wrap up by taking stock of how likely Americans were to vote in 2023. Since Trump was elected in 2016, the country has been in an era of historically high turnout in elections. Did that continue this year, and does that portend anything for next year?
Learn more about your ad choices. Visit megaphone.fm/adchoices"
