title,link,link_type,published,summary
Who Is The Likeliest GOP VP Candidate?,https://www.podtrac.com/pts/redirect.mp3/pscrb.fm/rss/p/traffic.megaphone.fm/ESP3168174619.mp3?updated=1692040931,audio/mpeg,"Mon, 14 Aug 2023 19:18:35 -0000","Abortion rights advocates notched another win in a red state. Last Tuesday, Ohioans voted by a 14-point margin not to raise the threshold to amend the constitution to a 60 percent supermajority. Instead, such amendments will continue to require a simple majority, making it likelier that Ohioans will pass an amendment to codify abortion rights in the state constitution this November.
Most of the post-election analysis concluded that abortion is a major driver of turnout in elections now, and it’s hard to deny in otherwise low-turnout environments, but should we apply these lessons to high-turnout environments -- like the 2024 presidential election -- as well? The crew discusses in this installment of the FiveThirtyEight Politics podcast. They also do a 2024 GOP vice presidential draft, in a world where former President Donald Trump wins the presidential primary.
Learn more about your ad choices. Visit megaphone.fm/adchoices"
Ohio Voters Weigh In On Abortion (Indirectly),https://www.podtrac.com/pts/redirect.mp3/pscrb.fm/rss/p/traffic.megaphone.fm/ESP6745344438.mp3?updated=1691441956,audio/mpeg,"Mon, 07 Aug 2023 20:57:26 -0000","Tuesday is Election Day in Ohio and it’s a bit of an unusual one. Ohioans are voting on whether to increase the threshold to pass constitutional amendments from a simple majority to a 60 percent supermajority. In this installment of the podcast, Galen Druke speaks with senior elections analyst Nathaniel Rakich about where the race stands and the broader trend of similar ballot measures.
Galen also digs into the New York Times’s first polls of the 2024 primary and general elections with Ruth Igielnik, the Times's editor of news surveys. Their surveys with Siena College during the 2022 midterms earned them the distinction of the best pollster in the country, according to FiveThirtyEight's ratings. At this point, their early data suggests that former President Donald Trump is far outpacing his rivals in the Republican primary and is tied with President Biden in general election polling. So, what should we make of that?
Learn more about your ad choices. Visit megaphone.fm/adchoices"
Emergency Podcast: Trump Charged In Jan. 6 Investigation,https://www.podtrac.com/pts/redirect.mp3/pscrb.fm/rss/p/traffic.megaphone.fm/ESP1089396705.mp3?updated=1690999992,audio/mpeg,"Wed, 02 Aug 2023 18:03:00 -0000","Did former President Donald Trump conspire to defraud the United States, conspire to obstruct an official proceeding, actually obstruct that preceding and conspire to willfully deprive American citizens of their right to vote?
Those will now be questions for a federal jury after a grand jury indicted the former president on four felony charges on Tuesday.
In this emergency installment of the podcast, the crew discusses what was in the Department of Justice's 45 page charging document, what comes next and how Americans are thinking about it.
Learn more about your ad choices. Visit megaphone.fm/adchoices"
July Was Hot As Hell. Do Voters Care?,https://www.podtrac.com/pts/redirect.mp3/pscrb.fm/rss/p/traffic.megaphone.fm/ESP8130349057.mp3?updated=1690845442,audio/mpeg,"Mon, 31 Jul 2023 23:12:44 -0000","Calculations from the World Meteorological Organization suggest that July was the hottest month on record. Throughout the month, heat records were broken across the globe. Phoenix, Arizona, recorded 31 days in a row of temperatures over 110 degrees Fahrenheit and Sanbao, China, provisionally recorded the country’s all-time hottest temperature of 126 degrees.
In this installment of the podcast, Galen speaks with Anthony Leiserowitz, the director and founder of the Yale Program on Climate Change Communication, about public perceptions of climate change, how extreme weather shapes those views and whether it's shaping our politics.
Galen also speaks with Kaleigh Rogers and Nathaniel Rakich about some of the latest GOP primary polling and how changes to election law in both red and blue states will reshape how Americans vote in 2024.
Learn more about your ad choices. Visit megaphone.fm/adchoices"
Who'd Win A Trump-less GOP Primary?,https://www.podtrac.com/pts/redirect.mp3/pscrb.fm/rss/p/traffic.megaphone.fm/ESP7876975371.mp3?updated=1690236568,audio/mpeg,"Mon, 24 Jul 2023 22:05:48 -0000","It is widely believed that former President Donald Trump will be indicted for a third time in the coming days or weeks, as he received a target letter from the Department of Justice last week. The potential federal charges involve the Jan. 6, 2021, attack on the U.S. Capitol and attempts to overturn the results of the 2020 election leading up to that day.
In this installment of the podcast, the crew discusses what Americans think about Jan. 6, Trump's role in it and whether he ought to be charged. They also draft a 2024 Republican primary lineup, under a hypothetical scenario in which Trump's legal woes catch up to him and the field is thrown open.
Learn more about your ad choices. Visit megaphone.fm/adchoices"
Why A Third-Party Candidate Poses A Threat To Biden,https://www.podtrac.com/pts/redirect.mp3/pscrb.fm/rss/p/traffic.megaphone.fm/ESP8012192271.mp3?updated=1689630753,audio/mpeg,"Mon, 17 Jul 2023 21:48:09 -0000","Campaign finance figures from the second quarter of 2023 were released over the weekend. They offered a first glimpse at many of the presidential campaigns’ finances, since most candidates announced their bids during the second quarter. In this installment of the FiveThirtyEight Politics podcast, the crew breaks down which of the 2024 candidates has been able to haul in the big bucks and who looks like they might have cash problems.
Also, on Monday, the centrist group No Labels is hosting a town hall in New Hampshire featuring Sen. Joe Manchin and former Utah Gov. Jon Huntsman. The group has said that they plan to run a moderate ticket in 2024 featuring one Republican and one Democrat (although not necessarily the two featured in Monday’s town hall). Early polling suggests that such a ticket would pull more support from President Biden than former President Donald Trump in a potential rematch. But is that a good or bad use of polling, 16 months out?
Learn more about your ad choices. Visit megaphone.fm/adchoices"
What's So Special About 'Bidenomics'?,https://www.podtrac.com/pts/redirect.mp3/pscrb.fm/rss/p/traffic.megaphone.fm/ESP3250392740.mp3?updated=1689021572,audio/mpeg,"Mon, 10 Jul 2023 20:33:00 -0000","Love it or hate it, this is President Biden’s economy and he’s taking credit for it. In recent weeks, Biden has been rolling out his economic pitch to Americans. It started with a high-profile speech in Chicago where he branded his policies as “Bidenomics” and positioned them in opposition to trickle-down “Reaganomics.” Since then, Biden and his campaign surrogates have fanned out across the country to make their pitch.
This is coming at a time when Americans are quite pessimistic about the economy. In recent polls, less than a third of Americans say the economy is good. But still, economic data paints a relatively strong picture. The unemployment rate -- according to data out last Friday -- stands at 3.6 percent. That’s close to a 50-year low. And inflation, although it remains somewhat high, has fallen to 4 percent from a high of 9 percent last summer.
In this installment of the podcast, Galen speaks with Jeanna Smialek, who covers the Federal Reserve and economy for the New York Times, and Neil Irwin, chief economic correspondent for Axios. They discuss how much of Biden’s approach to economic policy is actually new, what it looks like on the ground and why Americans are so pessimistic.
Learn more about your ad choices. Visit megaphone.fm/adchoices"
How The Supreme Court Will Shape The 2024 Election,https://www.podtrac.com/pts/redirect.mp3/pscrb.fm/rss/p/traffic.megaphone.fm/ESP2102572522.mp3?updated=1688408774,audio/mpeg,"Mon, 03 Jul 2023 18:22:13 -0000","The Supreme Court wrapped up its business for the term last week, closing out a docket that touched on the Voting Rights Act, affirmative action in university admissions, student loan forgiveness, business services to LGBTQ people, religious liberty and the power of state legislatures.
It was another term with high-profile cases, coursing through the heart of some of America’s cultural debates. In this installment of the podcast, the crew discusses whether this year’s decision could ricochet through the political environment, as last year's decisions did. They also take stock of what more we've learned about a still quite new 6-3 conservative majority.
Learn more about your ad choices. Visit megaphone.fm/adchoices"
What's With RFK Jr.'s Double-Digit Polling?,https://www.podtrac.com/pts/redirect.mp3/pscrb.fm/rss/p/traffic.megaphone.fm/ESP6833505471.mp3?updated=1687817501,audio/mpeg,"Mon, 26 Jun 2023 22:06:53 -0000","It's the final week of June and that means that we are anxiously awaiting the decisions in several high-profile Supreme Court cases. The remaining cases touch on issues including affirmative action, President Biden's student loan forgiveness program, business services to LGBTQ people and the power of state legislatures.
In this installment of the podcast, we take a look at what various public opinion polls have found on affirmative action and ask whether it's a good or bad use of polling. We also explore what to make of RFK Jr.’s relatively strong Democratic primary polling.
Plus, the Republican presidential primary field has grown again, with the addition of former Texas Rep. Will Hurd. He joins a crowded anti-Trump lane. So what’s up with all the anti-Trump candidates in a primary full of voters who like former President Donald Trump? And lastly, this weekend marked one year since the Supreme Court’s decision in Dobbs. We consider how that decision itself may have changed public opinion.
Learn more about your ad choices. Visit megaphone.fm/adchoices"
Are Millennials Getting More Conservative?,https://www.podtrac.com/pts/redirect.mp3/pscrb.fm/rss/p/traffic.megaphone.fm/ESP8402762246.mp3?updated=1687195350,audio/mpeg,"Mon, 19 Jun 2023 17:19:14 -0000","There’s been a lot thrown at Republican voters over the past few weeks. The field of primary candidates has doubled; the leading contender in the primary was federally indicted on 37 counts related to his handling of classified documents and alleged obstruction of justice; and a contest that had remained largely deferential to Trump has gotten more testy.
In this installment of the podcast, pollster Kristen Soltis-Anderson and Washington Post data columnist David Byler join Galen to look at how Republican primary voters are processing the news and what they want from a presidential nominee. They also ask the timeless question: What is up with the kids these days? Various analyses have come to conflicting conclusions about whether millennials and young voters in general are bucking a generations-long trend of growing more conservative with age. And they play a new game called “Which Candidate Said This?”
Learn more about your ad choices. Visit megaphone.fm/adchoices"
How Trump's Classified Documents Case Could End,https://www.podtrac.com/pts/redirect.mp3/pscrb.fm/rss/p/traffic.megaphone.fm/ESP2037831191.mp3?updated=1686697340,audio/mpeg,"Tue, 13 Jun 2023 22:57:32 -0000","Former President Donald Trump was arraigned on Tuesday at a federal courthouse in Miami in relation to his alleged retention of classified documents and obstruction of justice. He pleaded not guilty, setting in motion a trial that could potentially run in tandem with his campaign for president. In this installment of the podcast, Galen Druke speaks with law professor and legal analyst Kate Shaw about how the case will proceed and what the possible outcomes are.
Learn more about your ad choices. Visit megaphone.fm/adchoices"
"Emergency Podcast: Trump's Indictment, The Sequel",https://www.podtrac.com/pts/redirect.mp3/pscrb.fm/rss/p/traffic.megaphone.fm/ESP6651642884.mp3?updated=1686335776,audio/mpeg,"Fri, 09 Jun 2023 18:31:58 -0000","Former President Donald Trump was indicted on federal charges on Thursday related to classified documents he took from the White House. In this installment of the podcast, the crew discusses the severity and possible political implications of the charges.
Learn more about your ad choices. Visit megaphone.fm/adchoices"
The GOP Field Gets Crowded,https://www.podtrac.com/pts/redirect.mp3/pscrb.fm/rss/p/traffic.megaphone.fm/ESP8779640151.mp3?updated=1686005451,audio/mpeg,"Mon, 05 Jun 2023 22:46:53 -0000","By the end of this week, the number of major candidates running for the Republican presidential nomination is expected to grow to nine. Former New Jersey Gov. Chris Christie, former Vice President Mike Pence and North Dakota Gov. Doug Burgum are all expected to jump into the race this week. In this installment of the podcast, the crew discusses how these candidates might shape the race.
Also, the Republican National Committee announced the date and criteria for the first primary debate last Friday. The polling criteria are pretty notable, as there may not be that many polls that actually qualify. So is that a good or bad use of polling? And over the weekend, President Biden signed into law a suspension of the debt ceiling through January 2025 along with some cuts to federal spending.
Learn more about your ad choices. Visit megaphone.fm/adchoices"
There's A Debt Ceiling Agreement ... For Now,https://www.podtrac.com/pts/redirect.mp3/pscrb.fm/rss/p/traffic.megaphone.fm/ESP1634575944.mp3?updated=1685483052,audio/mpeg,"Tue, 30 May 2023 21:40:00 -0000","In this installment of the podcast, the crew talks about what’s in the debt ceiling agreement, why polls on the debt ceiling have been straight-up contradictory and what could happen if the legislation isn’t passed by next Monday. They also discuss the significant increase in laws involving sexuality and gender in Republican-led states and what Americans think about them. And Galen speaks with senior writer Monica Potts about her new book, ""The Forgotten Girls.""
Learn more about your ad choices. Visit megaphone.fm/adchoices"
The Case For And Against Ron DeSantis,https://www.podtrac.com/pts/redirect.mp3/pscrb.fm/rss/p/traffic.megaphone.fm/ESP9255496317.mp3?updated=1685036511,audio/mpeg,"Thu, 25 May 2023 17:37:23 -0000","Florida Gov. Ron DeSantis has officially entered the Twitter space ... er, presidential race. He kicked off his campaign in a conversation on a glitchy Twitter Spaces with Elon Musk and tech entrepreneur David Sacks on Wednesday. In his opening remarks, he stressed his electability and the ability to implement a policy platform that may not look all that different from that of former President Donald Trump.
In this installment of the podcast, the crew discusses what DeSantis's presidential bid will look like. In FiveThirtyEight's national GOP primary polling averages, Trump currently leads at around 54 percent with DeSantis at around 20 percent, although these things can change quickly in a primary environment. In fact, they already have: Just a couple months ago, Trump’s lead over DeSantis was half of what it is today.
Learn more about your ad choices. Visit megaphone.fm/adchoices"
Can Tim Scott's Optimism Win Over The GOP?,https://www.podtrac.com/pts/redirect.mp3/pscrb.fm/rss/p/traffic.megaphone.fm/ESP3656348850.mp3?updated=1684792132,audio/mpeg,"Mon, 22 May 2023 21:44:16 -0000","The FiveThirtyEight Politics podcast gets ready for a big week in politics. South Carolina Senator Tim Scott officially kicked off his presidential campaign in North Charleston Monday morning. We also expect the long-teased Ron DeSantis presidential campaign to become a reality this week. And, according to the Treasury Department we are just a week or so away from a possible default on the nation’s debt. National politics reporter at the AP Meg Kinnard and Data Columnist at the Washington Post join the crew to weigh in.
Learn more about your ad choices. Visit megaphone.fm/adchoices"
Is The Eurovision Song Contest Rigged?,https://www.podtrac.com/pts/redirect.mp3/pscrb.fm/rss/p/traffic.megaphone.fm/ESP4918669452.mp3?updated=1684443419,audio/mpeg,"Thu, 18 May 2023 20:43:00 -0000","Since 1956, European countries have been gathering each year to compete in the Eurovision song contest -- a competition of largely pop and techno artists that can often feel like a parody of European tastes in music. There have long been accusations of bias in the voting process and last Saturday's competition -- which Sweden won -- was no exception. In this installment of the podcast, Galen speaks with statistics and health economics professor Gianluca Baio, who created a model to determine whether there really are biases advantaging or disadvantaging certain nations.
Galen also speaks with Courtney Kennedy, vice president of methods and innovation at the Pew Research Center, who recently published a study showing that the polling industry of today bears little semblance to the polling industry at the start of the century. The days of real human beings randomly dialing landline phones are gone, but what does that mean for the accuracy of public opinion research?
Learn more about your ad choices. Visit megaphone.fm/adchoices"
Why So Many Americans Trust The Weather Channel,https://www.podtrac.com/pts/redirect.mp3/pscrb.fm/rss/p/traffic.megaphone.fm/ESP1571916953.mp3?updated=1684185407,audio/mpeg,"Mon, 15 May 2023 21:12:41 -0000","On Tuesday, voters are heading to the polls in at least three competitive races: the Kentucky Republican gubernatorial primary, the Philadelphia Democratic mayoral primary and the Jacksonville mayoral election. In this installment of the podcast, Galen and Nathaniel preview the state of those three races. They also speak with YouGov's Linley Sanders about a new poll showing that Democrats broadly trust news outlets more than Republicans, including even some right-leaning news outlets. And they look at how the public is reacting to last week's scandals involving former President Donald Trump and New York Rep. George Santos.
Learn more about your ad choices. Visit megaphone.fm/adchoices"
How Immigration Shapes American Politics,https://www.podtrac.com/pts/redirect.mp3/pscrb.fm/rss/p/traffic.megaphone.fm/ESP7401165867.mp3?updated=1683821512,audio/mpeg,"Thu, 11 May 2023 16:07:23 -0000","Title 42 is expiring on Thursday night, a pandemic-era rule allowing the U.S. government to turn away asylum seekers at the border as a public health measure. This comes at a time when apprehensions at the border are already at record highs and Americans give President Biden some of his lowest ratings on his handling of immigration.
In this installment of the podcast, Galen speaks with Georgetown economics professor Anna Maria Mayda about what Americans think of immigration and why, its impacts on the U.S. and its politics, and how that compares with other countries.
Learn more about your ad choices. Visit megaphone.fm/adchoices"
Does It Matter If King Charles Is Popular?,https://www.podtrac.com/pts/redirect.mp3/pscrb.fm/rss/p/traffic.megaphone.fm/ESP1431271604.mp3?updated=1683579219,audio/mpeg,"Mon, 08 May 2023 20:49:20 -0000","King Charles III was crowned over the weekend, which led to a lot of polls comparing his popularity to that of other members of the royal family. Long story short, the numbers aren’t great, but in some ways that's beside the point. In this installment of the podcast, the crew asks if polling non-democratic institutions is a good use of polling.
They also look at a recent ABC News/Washington Post poll showing both former President Donald Trump and Florida Gov. Ron DeSantis leading Biden in a very early 2024 matchup. And they talk about the 2024 Senate races that are taking shape. Republican challengers to vulnerable Democratic incumbents are announcing their bids, and a number of them are repeat candidates from the 2022 midterms.
Learn more about your ad choices. Visit megaphone.fm/adchoices"
How Climate Change Will Reshape Where Americans Live,https://www.podtrac.com/pts/redirect.mp3/pscrb.fm/rss/p/traffic.megaphone.fm/ESP1568624052.mp3?updated=1683229281,audio/mpeg,"Thu, 04 May 2023 19:36:00 -0000","For decades, Americans have been moving South and West. That migration pattern was visible in political terms when seven congressional districts moved between states after the 2020 census, and it continues to be visible in the booming construction and job markets in cities across the Sun Belt.
In this installment of the podcast, Galen speaks with author Jake Bittle, who argues that it’s only a matter of time before those trends reverse, or at least shift. However, as he writes in his new book, ""The Great Displacement,"" this time it won’t be cheap housing, low taxes and plentiful jobs that attract people to new places. It will be a harshening climate that pushes them away.
Learn more about your ad choices. Visit megaphone.fm/adchoices"
Where Biden Stands Heading Into 2024,https://www.podtrac.com/pts/redirect.mp3/pscrb.fm/rss/p/traffic.megaphone.fm/ESP8869194820.mp3?updated=1682980840,audio/mpeg,"Mon, 01 May 2023 22:36:15 -0000","President Biden announced his reelection campaign last Tuesday, a widely expected move that also brings us one step closer to a possible rematch of the 2020 election. The crew talks about the challenges and advantages that the campaign will bring.
They also discuss last week's decision from the North Carolina Supreme Court, clearing the way for partisan gerrymandering in the state. And they ask whether Americans can be trusted to reliably tell pollsters which high school cliques they belonged to.
Learn more about your ad choices. Visit megaphone.fm/adchoices"
Are America's Favorite Governors Really All Republicans?,https://www.podtrac.com/pts/redirect.mp3/pscrb.fm/rss/p/traffic.megaphone.fm/ESP3231274416.mp3?updated=1682372980,audio/mpeg,"Mon, 24 Apr 2023 21:45:03 -0000","Congress returned from recess last week to two ongoing conflicts. One was Sen. Dianne Feinstein’s absence from the Senate, stalling the process by which Democrats can approve their judicial nominees. The other was what to do about the debt ceiling, which has already been breached and could lead to the U.S. government running out of money as early as June. In this installment of the podcast, the crew discusses the latest developments and what Americans think about it all.
They also dig into new data on America’s most and least popular senators and governors, and ask which animals American are and aren't willing to eat.
Learn more about your ad choices. Visit megaphone.fm/adchoices"
Live From New York: It's The FiveThirtyEight Politics Podcast!,https://www.podtrac.com/pts/redirect.mp3/pscrb.fm/rss/p/traffic.megaphone.fm/ESP7107505476.mp3?updated=1682094527,audio/mpeg,"Fri, 21 Apr 2023 16:25:10 -0000","The FiveThirtyEight Politics podcast held a live taping at The Bell House in Brooklyn on Wednesday night, its first return to a live venue in New York City since the pandemic. Nate Silver and Galen Druke dissect a recent poll suggesting 30 percent of New Yorkers want to leave the state, challenge ChatGPT to see if it can replace their jobs and discuss the current state of the 2024 Republican primary. They also welcome a surprise guest and an audience member to play a round of New York City-themed trivia.
Learn more about your ad choices. Visit megaphone.fm/adchoices"
The Next Supreme Court Clash Over Abortion,https://www.podtrac.com/pts/redirect.mp3/pscrb.fm/rss/p/traffic.megaphone.fm/ESP9991314227.mp3?updated=1681766457,audio/mpeg,"Mon, 17 Apr 2023 21:16:06 -0000","The Supreme Court is set for another high-profile clash over abortion rights. Last Friday, Justice Samuel Alito issued a temporary stay in a case challenging the FDA’s approval of mifepristone, a drug used in medication abortions. It means that for now the status quo stands, but in this installment of the podcast, the crew talks about where things could go from here.
They also discuss South Carolina Sen. Tim Scott’s pitch to Republican voters after the launch of his exploratory committee for president, and the potential impact of Montana Republicans’ attempts to change the state’s election laws for the 2024 U.S. Senate race.
Learn more about your ad choices. Visit megaphone.fm/adchoices"
Americans Are Feeling Better These Days,https://www.podtrac.com/pts/redirect.mp3/pscrb.fm/rss/p/traffic.megaphone.fm/ESP5088120348.mp3?updated=1681413432,audio/mpeg,"Thu, 13 Apr 2023 19:12:33 -0000","According to Gallup’s National Health and Well-Being Index, the negative emotion consequences of the coronavirus pandemic have subsided to a large degree. According to recent data, 17 percent of Americans said they were lonely “a lot of the day yesterday,” down from a pandemic high of 25 percent. Galen Druke speaks with director of the National Health and Well-Being Index, Dan Witters, to get an understanding of what American life satisfaction looks like today.
Learn more about your ad choices. Visit megaphone.fm/adchoices"
